{
  "version": "9.0.1",
  "timestamp": "2026-07-02T01:59:57.176939+00:00",
  "source_tool": "run_review",
  "project_profile": {
    "platform": "freertos"
  },
  "suite_run": {
    "suite": "default"
  },
  "issues": [],
  "generated_files": [],
  "fix_suggestions": [],
  "reproduce_commands": [
    {
      "command": "python tools/run_review.py --dir examples",
      "description": "复现审查"
    }
  ],
  "verification_results": {},
  "assumptions": [],
  "metadata": {
    "tool_version": "9.0.1",
    "files_checked": 19,
    "exit_code": 1,
    "total_checkers_run": 34
  }
}