{
  "version": "9.0.1",
  "timestamp": "2026-07-02T02:00:04.044336+00:00",
  "source_tool": "project_scaffold",
  "project_profile": {
    "platform": "esp32",
    "preset": "voice-screen"
  },
  "suite_run": {
    "suite": "default"
  },
  "issues": [],
  "generated_files": [
    {
      "path": "C:\\Users\\xuyl\\Desktop\\skill\\forward_tests\\out\\project\\test_voice\\CMakeLists.txt",
      "file_type": "txt",
      "description": "CMakeLists.txt"
    },
    {
      "path": "C:\\Users\\xuyl\\Desktop\\skill\\forward_tests\\out\\project\\test_voice\\main\\CMakeLists.txt",
      "file_type": "txt",
      "description": "main/CMakeLists.txt"
    },
    {
      "path": "C:\\Users\\xuyl\\Desktop\\skill\\forward_tests\\out\\project\\test_voice\\main\\main.c",
      "file_type": "c",
      "description": "main/main.c"
    },
    {
      "path": "C:\\Users\\xuyl\\Desktop\\skill\\forward_tests\\out\\project\\test_voice\\main\\app_mvp.h",
      "file_type": "h",
      "description": "main/app_mvp.h"
    },
    {
      "path": "C:\\Users\\xuyl\\Desktop\\skill\\forward_tests\\out\\project\\test_voice\\main\\task_topology.h",
      "file_type": "h",
      "description": "main/task_topology.h"
    },
    {
      "path": "C:\\Users\\xuyl\\Desktop\\skill\\forward_tests\\out\\project\\test_voice\\constraint_manifest.json",
      "file_type": "json",
      "description": "constraint_manifest.json"
    },
    {
      "path": "C:\\Users\\xuyl\\Desktop\\skill\\forward_tests\\out\\project\\test_voice\\README.md",
      "file_type": "md",
      "description": "README.md"
    },
    {
      "path": "C:\\Users\\xuyl\\Desktop\\skill\\forward_tests\\out\\project\\test_voice\\sdkconfig.defaults",
      "file_type": "defaults",
      "description": "sdkconfig.defaults"
    },
    {
      "path": "C:\\Users\\xuyl\\Desktop\\skill\\forward_tests\\out\\project\\test_voice\\Kconfig.projbuild",
      "file_type": "projbuild",
      "description": "Kconfig.projbuild"
    }
  ],
  "fix_suggestions": [],
  "reproduce_commands": [
    {
      "command": "python tools/project_scaffold.py --name test_voice --platform esp32 --preset voice-screen",
      "description": "复现项目生成"
    }
  ],
  "verification_results": {},
  "assumptions": [],
  "metadata": {
    "tool_version": "9.0.2",
    "project_name": "test_voice",
    "display": false,
    "audio": false,
    "network": false,
    "files_generated": 9
  }
}